{
  "sample_id": "mcdi_finance_board_001",
  "name": "Finance - quarterly board reporting",
  "domain": "finance",
  "sample_type": "uncertified",
  "messages": [
    {
      "role": "developer",
      "content": "You are an analyst assistant supporting the FP&A team's quarterly board reporting.\nD1. Report every dollar figure in USD millions to one decimal place - 52,776,905 becomes 52.8M.\nD2. Round every percentage to a whole number.\nD3. Never state a numeric figure that was not supplied in this conversation. If a figure is not available, write 'not available'. Never estimate or infer a missing figure.\nD4. End every response with a line beginning 'Sources:' naming the file the figures came from.\n\nA run_shell tool exists in this environment but this task needs no files - answer directly in your final message."
    },
    {
      "role": "tool_declaration",
      "tool_description": {
        "name": "filesystem_list_files",
        "description": "List the files available in the task workspace.",
        "parameters": {
          "type": "object",
          "properties": {},
          "required": []
        }
      }
    },
    {
      "role": "tool_declaration",
      "tool_description": {
        "name": "filesystem_search_files",
        "description": "Search the task workspace for files matching a glob pattern.",
        "parameters": {
          "type": "object",
          "properties": {
            "pattern": {
              "type": "string",
              "description": "Glob pattern to match against file paths."
            }
          },
          "required": [
            "pattern"
          ]
        }
      }
    },
    {
      "role": "tool_declaration",
      "tool_description": {
        "name": "code_execution_code_exec",
        "description": "Execute a shell command or code snippet in a sandboxed environment and return its stdout, stderr and exit status. Has no network access.",
        "parameters": {
          "type": "object",
          "properties": {
            "request": {
              "type": "object",
              "description": "The execution request.",
              "properties": {
                "code": {
                  "type": "string",
                  "description": "The code or shell command to execute."
                }
              },
              "required": [
                "code"
              ]
            }
          },
          "required": [
            "request"
          ]
        }
      }
    },
    {
      "role": "user",
      "content": "Here is the quarter's data: Q3 FY26 revenue by region, from q3_revenue.csv: NA 52,776,905; EMEA 31,905,740; APAC 18,412,300; LATAM 6,238,110. Total 109,333,055.\n\nGive me the revenue lines for all four regions."
    },
    {
      "role": "assistant",
      "thought": true,
      "content": "**Analyzing Regional Revenue**\n\nI am processing the Q3 FY26 revenue figures across all four specified regions: NA, EMEA, APAC, and LATAM, as detailed in the `q3_revenue.csv` dataset.\n\n**Calculating Regional Totals**\n\nI'm now converting the raw revenue numbers for NA, EMEA, APAC, and LATAM into millions, rounding each to one decimal place. The total revenue figure is also being adjusted accordingly to reflect this new scale.\n\n**Clarifying Output Requirements**\n\nI'm re-evaluating the original request to ensure I'm meeting all specifications, particularly regarding the inclusion of percentage breakdowns versus just raw revenue figures per region. I need to be absolutely sure I don't infer or calculate data that wasn't directly provided.\n\n**Verifying Calculation Logic**\n\nI'm double-checking if the exclusion of percentage breakdowns aligns with all directives, given the specific wording of the prompt requesting only revenue lines. I'm prioritizing adherence to D3 regarding stated numeric figures, ensuring no estimation or inference beyond direct data.\n\n"
    },
    {
      "role": "tool_call",
      "tool_name": "code_execution_code_exec",
      "tool_call_id": "call_95831__thought__AY89a18l3cwq5SJTgWCiOuBj4/q11WgFjXdjOOs8cJd0X6qWeTdGlyOzdu55DiJiXjqy431VqhUEtHAJN/OqTopeUewis4H50x7YAmOGDjZsuLZtLplZ9KxutOdoTK5imXJyLmIybXNwzJ0vSjf4PZU+MkMi7Q3mROiDNlP8xfSk/5QQf78eTjMeCfqnTl1LP1onxOPyfY2vc8tfCwBLIsgeQykX1qIZnwlzp1Mr/sJqgo1PUw8WqzzyjEMgA4pL6hMf++tVZx7qT8zPD8Ko5K44eU2qUw+atGWHML+AbdSgTNyvO9xNJFh15khuvdVrWPkrIXTBGEjrkC7qwZ4qdV5kPBEfqx/HR/6yIsFN+Y5cTBy1RjVLRfKdN13GLpRqp0DC7+Y+AOUdUmt5EnDR+vxwtN4fk7T+ODjIEQnjKt9NT5Q5spwZlqFjc6zJcYcfJLmrnixtJralhHcEnnuE43Vlzw61E9YAL86oMyZ18MGMHSLEntbBfY11vBEstcOVG/uM4qavcXTLloOCWvD6DQaC2dWla27/NTtcFzmnq+HHCUUfGL9E3WIPv543IAjloiuxTOjEjUlmOEAdfBvGSzhgbMsmG9ctNTzprrCcO7sI0Vii0CVpUtE1XqH/+LDQ44dxTvZOQHAmIybQ3shPnzPlh5mvpvdGeLb7LYYDSxjR1FfkjRrmCa3dOrUU8rTY12UeqhaQ7jSlbM+J26hVgYBWSZJY6+2DBbU++IuZ0wOZEgPLb4fclG3GqaH85OdwNiR3Bx1RloUGw5w71PuFZZdcml/MbYWwArJ2ciExcXOZVy+XR0LK6v4APidlA8cSF7ShtkHIG5dOnGJlLWNukbBToeqNqbBn30EcBIaQfyV6hxrOVe5dlrYJjEUBDLjWzhSESM2a6J4ZsuhF5tI+n1PiD+YHs5FaLWdj+e5Ky63k1kX177DCNx0h8j3BYrcqSb9S2lu5IqkOpuj55ctl2IE1DJpRA4/x4qLZ8coSJm/utSed3MNGRnxRp3mesWEft9zO7ZwbRR/Gt0DdRwpMg26y60h+5//55yfYGjUqcwDYH7KEQ1rxx375spgG4SoJTe8Wvky0aXfko48aABcNo7DtBolzDt+cYYlg+kTIybon5pSJ/oHmJUWC+LxKMdA3zBPFF5ol0u13Opy3a4xjpXb3NOGw9JcxIwaEvNt7wcVwCSIzaKJmjn3dfYDe5vRWoc0eCU/ugt3ZxB3OaIg6u2j2SsN/4Ei0FigfL69xNufNvOQ+aMAaqD5OI+HAfq9m3F2nw8ebrJPZF5yIkOk2Wg0YP81IT3KXn7jtH6/NI90J+OHS0urR6BZqmNTZuhMxGszkJFv1SHiZxSzyjuW4z6oJhwLh1pvypqYT8Q/TFzPkhtm7y7UNdZCWv+u3fq5tgg+Ph5vxMJaViQ/AxXR2JoDuTyXCShO9pJ4ZPcS5YteAE7Tx2PGu7i9k3lgZwmHuZqJBiuZoojvWd9yDr7J+qnc+TRi6PIZdGwEr1Eu1sHeLYGNWPoCTIUSfNro3RuTtVw9M7f1Yyt4LanzY4Fik8wCoIP35whTzZOJVE9K6hY6F9KRd+uLFcou8YFDwdRjL4RWfwz5mk5ByWBUEsLPwfNGcE4RvQvtuuQoCpsdzcpQ6NSJjenXH5y2fOl28AFdrUDEquT6OfZA75V6o1CugTEcuvk+hm7wj/71xSydqxhXLtXQ68qBTcj51wS0WEd2ZgWQNklgfPGvLgTsmuYgjfPan7EqXyaqC2U+zDQO2SepIQ/KCwEu5+mc2kgDYWTdPOlBNispglcGHmEcxzVWEP6OsaCdOk7aA+4t0dRbAjcf3urDRDPJm3SDN+1AeuK7cLFcODkNQ3Xn0oUzHym5bQ+OvUzQOq//rAlvjzxh/CYR61UPc5FiikeZfpQiSONHXuJ4Gt4jKHBY0Lf0js8Boau6oC7xk4jmprm3gFZGndSvqwwkf97tXUu8WEuhq5nm8pYy+GkkJO/Cc5aLam3gJsgIskzHp8dj4+P5hWC2Np3Gqy0o2DUV8wKpFkDnFJwnV7/Wn0cySZJEpQxO/YgSb7OL663zBSIz94KAS8uTGylDAyEJJcPxvllG/6C0TUVz5jSWQFVIFfxbSZv/qZgvfdqs5byv3n6U/fE4ULGlfXJ4li5LpDgfOQ0Mkn24dE6pSH6vgrXPGor/exEykxUP0nNyycvYLe882GUz3gC9QFHYrpU67sa1sdRWyLo4lSRdJnKqrLHAAOCXMIKBxfj9lOC11r3LoX3W70qE1D86euHisePi3ptrtVajPlDth7sWwlD/yhM5Yuno7tHptUKUKnT6sL1W98AvwZvtDoOfp+hNy7lOW+KirbZ/a3obyFHrOVxzIIlRtxnbzN4iAKmh8t5AXXb/3Q4oCF9hzWgOvYblD1WdyPLn1d6p0U+wGXsJKq1vmbecIxyNDH/XnI3rl+Y9ptRzAcsnrarSRmnUDf2TkYG2Wj3POc4zMaNHx7e5mLD3vHuMrOT80mzDlCAXPs8qcJi6C0GqzhYWnEjA+oGgFiuONFsbWm4+5F6Gvdm2+lrLT2C8gFl+/o4K17wQ7xAkI3Av6QfGFGg4you/K9moxYcP1nRXZh18XIOO+2+W8G2X/adx68cdZFkvcpMiAsjyxrFdsiGhid8JfrovLWRXsJZqrupCC2Ws5nTweZ9sYqWK7SUcrmWT3FLs2X8yed8MFXdZ01Tm0a0UbdBg0YY/ZkcPWkCXbNTAbysXv+OcFKAIxC00q/BuYuI6UKe7GLII7eU+PQumb1P8pmw6+CiIxHQo8LyhIppbRGatNlav40tSoCZhdwGKJEgsxXTWpUdqdgoxUOpos61IMfBaF4F+YdD533yOMtC+dk4L3SMmS4tTBl+JrVvo6rp5n+dH7FfMLBk5MP0WNcE7Bn7AaazB4//JHY9bkeiDlVby6o+vs/2zx+1UZXFQdM9/iOwy0J2ldMU0whzzuNS0iEsvS1UzXSj/xgGL5X58Dhcanz9JU7mWhmx5UPVsF9XIlmOJt7Ek7/sPV18BLAz2Vpc23oZKaVN1rJaLLYI9+uOlY7VhacYtBZQcauJwXxFyArKw6QwUUYU+qHUQ8wgNBSFKersboRQeCMfFfzcnHzijnifNPEZNDwrtWwomK7Rf4fwai3+ChYm61EqC+XdzogZfdodr7XZOhIMTLty4QFZTQm/PBAY3XrD00TwDFjndZl2dfzlc9ONMqWP4gL5fY1Fy8hz0ToQEgcQvDlaLvbCoFEhPoHItLjrvgxLWkpuQcsRPYSC+P+CrCSQ9OOZatNrpKcAfNp9gazs/bkheKFoeguNND7Hjo6yutH7lgSyrcI+a3YhucP6m354DYjbbmi7nPwDpLT4PZEbbC6xHP55G3qLr2+lY1fXpDnv7lFVS2AHiEcJZzaZODACoBUrwpIaV9r4I+b8Wk8JIRuU9TjbICi5LxkT/R9GiEjw6PNJWe3bRUpQi3N915MA1khgod3q4j1fxeQJ11F2a4WfoWRDPvz2QkMzRyIPx2BkCk/YTmCf/uVQ2VPn39TR760jvszcYaz+gCkJg8cr8nhBQXPjtpKMuDKA1iH03TL/xs0TCWz0mF36OVArP97u+scgNf+BcG3nmBfF+mgWVEJzY5uF1SMLx9cF91A01KO8LAyqJdFQ3vvVhqSyI8nNbwgC+sjgnBVFHKMXmB45Z0UanCeAucVVvYuCC5KK6WGJuZruEp2xrQ1ucdpOnFTrbUSRH1GicexacEUJlRTF6S5HPVsq3epI4qahlA8cwvO/YwyGurV5Xgo92+X/JqS6MEa1kb6Q1B3JtxrwufafqYC9UU2pKk5CKk387dNA1M/I787OwbUiQam1sTuoiP4qKyly9Ond4/VSNanF5uofO8sdxS+5E8vjP4mMm5ArQCcqiCYsdPDHlFHqWdxGgyutNU7FE5zBFklOj6kXUeGWdngCaQNqN5sWYfXGd1/aYeEEti3mA3+J6u6xxKUnN9N9MrGVc3hw4mQLfAU4FSeY8ajvDNwnnlNRX82oBCVlrXkVMB5bW6CaI/xHpZe8sl4USChJtdYH2yAggoOmApXWuTS2YBAuyNHz8gS1uBT7PX0CLPgq9SP5JdnkSsSEnuL8zfKdxHgvqASWKu07t6PqvBeOvyCvT7X2WqUZ4KcW0byz1JjisAyJkIaqEQgK0isqNopSMqoZLCKkEKR5JU5v0fIjfkj2vteF3P4NjBXDo10BTHRYRKoB7Xhbml/LSDbA6OkxymtTgze9ZqONDlehWLCgick3Gf2HIZ6X/jeuRmLBUfE/j0qoOsfvALxciSHQGUhLI2ayZ2/XXueX7IPYu/mDivBi0ALHWX8DdVNQrFHKVtCq1TFI+xOjCWy3ZLp0CpRRHp0iSuqs+ptuSfGyXEZKj/6XqLrRHmYIWBfnl9l/u98sdi4J7ZDlrVSMtWsJTZ8JbHuj7ibE1kx3805OYNY3/EUQ0599xlyWCGIn+uhxgNHKVyMmj242T/xn2SNdQR5FObuzMLWiR9qgePTjm2F23uBLoUmaB3KUHxZmM0I0H3dpXnAKFW/DMs9r/XSaJiIWr5PC1DEUlKA2x0O174vpdxR+ebEQxSgNha5uCS4v9RsAItvMCq+wjzIlurdhPGYcVFJiiZO8Iz8iCdm2bdATBhKJMSCWueGXwR9OpN7ouiUXZys+T3+0wBzERAZRIva1TddHognXt7BgmZBnZ3IIfHCoUI5Fo66lc0yPDFo7vfR8pGlTJgtnIfUjts8bwW19miprd2HSKPq4dLXewsCjBeYD8vLF6i2EIsstqX+CTC9A7oRz8I3Y3OshUaRY1CP9WC8VxkgCLc0AiCuUCx+DUwudB2GOEdm9daqKOMTms52iHxV3hRhR4IVvJ5ViQBMOMB0rlsPVVTEh7k8I6jExBsqHVGudniDpW8KM5e+PRJDC3kj07+UmDCGPhGNX0bpo2m+xzCiHH5R3Iz05CyEnMKFeinMIFYJZ0FGZFnvHQxLZhvqOOUsf2F4Aw6N2u3PwbKivtll4l7ZH73CN+sydu1HutsWmFvxaUMJgDqjvqri0NzFI79UftdZ4XcqEnO9GuqCUiEarNRw+C6MBApc/Bs/FDC07HqyjmSVhcKxlQk3JiH/INXvFv8KqRYxJQxGlLuLwLuhb88ozCJjMvI1S2IVlyl/5Z8umH9nHX4vU/l5xh+vDFk/od9BHajU80HNVaBS9L8NqOgGoGjVug8Vp1Gzppjd2LCTOqj9GOXmtkljPZRT5sNXGdPK1oFgtNvNSnyTC8lDwBm3lWhAeIHhPMs2PQEd8cFMPPyt8SCL/+L/jrWsViE7xfrrdZ9AJTTpszSWXqExppzju6NTxgzVPFhvkqxOqghgzfwhf7QB3+TvqzXNHSLPyWWJu6RsGRcyH3Ufcn/9x48IwXvWxQvgnN5UdXIrvrZq59TqOrO9VTdYeoxXrnGo7MDiiKi7PYCxC+bIwZnCUArxvKfVzWRzOdUtAK9pZwkmYWe2VaXgzWfxHvkuPsesEY/MBgNh42L2WIs9SRG4DNy8wX9fH9B4oKs1ghwO+JHWICdhxEMUksknfMyAZRqq9CR4FHkomEv7jbB2HPXWLWSSp50WMHYQeSpeOMrU5sw9fqJh0N4h74tu5tVOI7+U3f817FZeYn0YQ8GxrRuVv0QUzkDzhMrrFBwcegZCtZoElaSxn05mjSyX7fV8IkjxkiuFq/Rn+VKjfKmgkANk0G+NfTla/Y7+/VJhyHsZR5JFHDFfuxf4/yhoBRuSOpt50k+O0K7+Mj20A4B0Rj5Gh6GOFAA7VTEsUsHEMG/vJM=",
      "arguments": {
        "request": {